{
  "$schema": "https://json-schema.org/draft/2020-12/schema",
  "$id": "P0.W4.NATIVE_ARTIFACT_CONTRACT_SCHEMA.V1",
  "type": "object",
  "additionalProperties": false,
  "required": [
    "$schema",
    "schemaVersion",
    "contractId",
    "owner",
    "consumerOwner",
    "status",
    "artifacts",
    "drainContract",
    "finalImageContract",
    "consumerAcceptance",
    "consumerInventoryRequiredFields",
    "unverified"
  ],
  "properties": {
    "$schema": { "const": "./native-artifact-contract.schema.json" },
    "schemaVersion": { "const": 1 },
    "contractId": { "const": "P0.W4_W6.NATIVE_ARTIFACT_CONTRACT.V1" },
    "owner": { "const": "w4" },
    "consumerOwner": { "const": "w6" },
    "status": { "const": "interface_ready_target_unverified" },
    "artifacts": {
      "type": "array",
      "minItems": 3,
      "maxItems": 3,
      "uniqueItems": true
    },
    "drainContract": { "type": "object" },
    "finalImageContract": { "type": "object" },
    "consumerAcceptance": { "type": "array", "minItems": 1 },
    "consumerInventoryRequiredFields": {
      "type": "array",
      "minItems": 11,
      "maxItems": 11,
      "uniqueItems": true
    },
    "unverified": { "type": "array", "minItems": 1 }
  }
}
