{
  "$schema": "./native-artifact-contract.schema.json",
  "artifacts": [
    {
      "artifactId": "agent-teams-instance-lock",
      "buildRecipeId": "w4-native-c17-v1",
      "finalImagePath": "/app/bin/agent-teams-instance-lock",
      "imageOrder": "executes before Node, listener bind, migration, recovery, spawn, or effect code",
      "protocolManifestPath": "docs/research/hosted-web/phase-0/host-primitives/instance-lock.protocol.json",
      "protocolSha256": "ded8949371646d490ba5175cf2992cb308df6fdca44537d91d728345be3b139f",
      "spikeSourcePath": "scripts/hosted-web/phase-0/host-primitives/instance-lock/instance_lock_spike.c",
      "spikeSourceSha256": "d9cc83ae82e3a1c11e654db39ecf6ddceea78f23f455db707cb5876652118c57"
    },
    {
      "artifactId": "agent-teams-process-anchor",
      "buildRecipeId": "w4-native-c17-v1",
      "finalImagePath": "/app/bin/agent-teams-process-anchor",
      "imageOrder": "spawned only after lease admission and workspace registration",
      "protocolManifestPath": "docs/research/hosted-web/phase-0/host-primitives/process-anchor.protocol.json",
      "protocolSha256": "13cbcb756515ae565eef1abfeb8386c38d9857bed3f8e308de33d3e9b751c55b",
      "spikeSourcePath": "scripts/hosted-web/phase-0/host-primitives/process-anchor/process_anchor_spike.c",
      "spikeSourceSha256": "4cb28efb87c9a7fa50a1c083219c0b5095d850223c95348ca19d94ac62207e95"
    },
    {
      "artifactId": "agent-teams-workspace-guard",
      "buildRecipeId": "w4-native-c17-v1",
      "finalImagePath": "/app/bin/agent-teams-workspace-guard",
      "imageOrder": "invoked per admitted bounded workspace effect from a neutral cwd",
      "protocolManifestPath": "docs/research/hosted-web/phase-0/host-primitives/workspace-guard.protocol.json",
      "protocolSha256": "d73abe4570fb87f42824c22e84a184fd617bd42384f097e4fae341c1d33b02c3",
      "spikeSourcePath": "scripts/hosted-web/phase-0/host-primitives/workspace-guard/workspace_guard_spike.c",
      "spikeSourceSha256": "66f7c58d1188fd8d4be09bdd890458002dbbe40bf94b153155f1f9a54366ab43"
    }
  ],
  "consumerAcceptance": [
    "W6 emits one inventory row for each artifactId with final binary SHA-256, protocol SHA-256, build recipe ID, builder image digest, compiler identity, target ABI, UID, GID, mode and finalImagePath",
    "W6 proves the instance lock executes before Node and that all three artifacts exist, are stripped, are executable only as intended and load under the final image ABI",
    "W6 proves the final image contains no W4 spike source, compiler, linker, headers, object files or build cache",
    "W4 reruns the marker-owned lease, guard and anchor probes against that exact W6 image digest and records final UID, init, seccomp, mount and stop-grace results",
    "Any missing row, hash mismatch, syscall denial, stale protocol version or unclassified drain keeps dependent capabilities absent"
  ],
  "consumerInventoryRequiredFields": [
    "artifactId",
    "finalImagePath",
    "binarySha256",
    "protocolSha256",
    "buildRecipeId",
    "builderImageDigest",
    "compilerIdentity",
    "targetAbi",
    "uid",
    "gid",
    "mode"
  ],
  "consumerOwner": "w6",
  "contractId": "P0.W4_W6.NATIVE_ARTIFACT_CONTRACT.V1",
  "drainContract": {
    "kind": "process_drain_outcome_v1",
    "producerProtocol": "docs/research/hosted-web/phase-0/host-primitives/process-anchor.protocol.json",
    "w6ConsumerFields": [
      "kind",
      "outcome",
      "purpose",
      "resetGeneration",
      "deploymentGeneration",
      "processAnchorGeneration",
      "classificationId",
      "residuals"
    ]
  },
  "finalImageContract": {
    "buildRecipe": {
      "builderImageDigest": "required from the admitted W6 image manifest; no floating tag is accepted",
      "compileFlags": [
        "-std=c17",
        "-O2",
        "-Wall",
        "-Wextra",
        "-Werror",
        "-D_FORTIFY_SOURCE=2",
        "-fstack-protector-strong"
      ],
      "determinism": [
        "pinned builder image digest and compiler package versions",
        "fixed SOURCE_DATE_EPOCH, locale, timezone, umask and output names",
        "strip debug/build-id variability under one checked-in recipe",
        "two clean builds compare binary and manifest SHA-256 values"
      ],
      "recipeId": "w4-native-c17-v1"
    },
    "filesystem": {
      "compilerOrSourcePresent": false,
      "rootReadOnly": true
    },
    "runtime": {
      "capabilitiesDropped": true,
      "finalUidNonRoot": true,
      "initRequired": true,
      "noNewPrivileges": true,
      "seccompProbeRequired": true
    }
  },
  "owner": "w4",
  "schemaVersion": 1,
  "status": "interface_ready_target_unverified",
  "unverified": [
    "No admitted W6 final image digest or pinned builder digest exists in this W4 remediation.",
    "No final-image binary SHA, ABI/load result, non-root UID, init ordering, seccomp result or two-clean-build comparison is claimed.",
    "The three current C files remain feasibility spikes; Phase 1 must define bounded production implementations without weakening this contract."
  ]
}
